{
  "schemaVersion": 1,
  "provisioningState": "pending-reviewed-digests",
  "requiredIdentities": [
    "FORGE3D_APPIUM_EXECUTABLE",
    "FORGE3D_BROWSER_INVENTORY_HELPER",
    "FORGE3D_CLOUDFLARED_EXECUTABLE",
    "FORGE3D_CONTROLLER_GH_EXECUTABLE",
    "FORGE3D_CONTROLLER_HOST_CLEANUP_HELPER",
    "FORGE3D_CONTROLLER_RUNNER_VERIFY_HELPER",
    "FORGE3D_CONTROLLER_SIGNING_PROVIDER",
    "FORGE3D_DEVICE_CONTROL_HELPER",
    "FORGE3D_GECKODRIVER_EXECUTABLE",
    "FORGE3D_PLAYWRIGHT_MODULE",
    "FORGE3D_UPDATE_CONTROL_HELPER"
  ],
  "allowlist": []
}
